{
  "schema": "math-commons-job-asset/v1",
  "job_id": "weber-lehrbuch-algebra-v03",
  "wrapper_directory": "weber-lehrbuch-algebra-v03",
  "source_files": 11,
  "source_bytes": 48905392,
  "canonical_stream_bytes": 1114,
  "source_tree_sha256": "3F8FF2AAEC103A34CC7BF9B9ACEB434B024969F32A237CD39D0C0553D5FD9565",
  "asset_count": 1,
  "assets": [
    {
      "name": "weber-lehrbuch-algebra-v03.zip",
      "part": 1,
      "parts": 1,
      "source_files": 11,
      "source_bytes": 48905392,
      "first_path": "00_READ_FIRST.md",
      "last_path": "99_VALIDATION_RECEIPT.json",
      "zip_bytes": 47068502,
      "zip_sha256": "2BA4BC628519337D484EADF167EA8D60BAAD81393DB0B494C0898DBC9CEFA51F"
    }
  ],
  "members": [
    {
      "path": "00_READ_FIRST.md",
      "bytes": 3646,
      "sha256": "0DD800EBF0AB0C5616597A04954F074FB32AF9314A6C29C406D748A34979F75A"
    },
    {
      "path": "01_GOVERNING_INSTRUCTIONS.md",
      "bytes": 3079,
      "sha256": "2505BAF576F74B55E750E6699A4A6ED922FCB1C5116F2C6D913873121DB39757"
    },
    {
      "path": "02_SOURCE_OUTPUT_MAP.tsv",
      "bytes": 603,
      "sha256": "C9CCF0839FECB93D127593014BA57FE27E492997B13004C80C6B5800EC4B5E18"
    },
    {
      "path": "03_INITIAL_STATE.json",
      "bytes": 788,
      "sha256": "1B54566F616466460D4A56A40E68375A6F14E00DF3267C0A94255221376B37F9"
    },
    {
      "path": "04_ALL_45_LITERAL_SESSION_PROMPTS.md",
      "bytes": 241327,
      "sha256": "59A99E81FA910F53FD2C025666F122F685D4E6409356BFCCA41CFF98E7285503"
    },
    {
      "path": "22_AUTHORITY_BAND_III_772P.pdf",
      "bytes": 44789436,
      "sha256": "25C31D0E2D8E17989C3FBB2B773142508BB405BA211C230D130E63D73A945387"
    },
    {
      "path": "33_PRIOR_BAND_III_GERMAN_UNTRUSTED.pdf",
      "bytes": 2637972,
      "sha256": "05AB8858D309A9CC429818D34A75EB89206087F7CF7440ECC678D5E11475CAE1"
    },
    {
      "path": "36_PRIOR_BAND_III_GERMAN_TEX_UNTRUSTED.zip",
      "bytes": 1216653,
      "sha256": "447AB91702E7153663D6D411D1A6E753C10508D36E5DE51E27ACD8775FBB9A21"
    },
    {
      "path": "43_PAGEMAP_BAND_III_UNTRUSTED.json",
      "bytes": 8660,
      "sha256": "DDD95E31EBE0AC7995195128B615BCD552891D12B1DC8F298453EA7EDB4A0F5D"
    },
    {
      "path": "98_PACKET_MANIFEST_SHA256.tsv",
      "bytes": 936,
      "sha256": "B3719885A3C7543B480D91ED8D471D9300AE627D99C657C0E0B7C996FA8DE96C"
    },
    {
      "path": "99_VALIDATION_RECEIPT.json",
      "bytes": 2292,
      "sha256": "E585464E7411A31CF5BC605C5EE94712A14959515558A6ED7ED942F02B085247"
    }
  ],
  "checks": {
    "source_hash_replay": "11/11",
    "zip_member_replay": "11/11",
    "crc_errors": 0,
    "missing": 0,
    "extra": 0,
    "byte_mismatches": 0,
    "hash_mismatches": 0
  }
}
