{
  "schema": "math-commons-job-asset/v1",
  "job_id": "al-khwarizmi-al-jabr-cairo-1939",
  "wrapper_directory": "al-khwarizmi-al-jabr-cairo-1939",
  "source_files": 26,
  "source_bytes": 406771312,
  "canonical_stream_bytes": 3095,
  "source_tree_sha256": "2D4EBAAFCC8F0F08932B4DED329997AA742EA683DCFD7F5DACE9DE834F8BB554",
  "asset_count": 1,
  "assets": [
    {
      "name": "al-khwarizmi-al-jabr-cairo-1939.zip",
      "part": 1,
      "parts": 1,
      "source_files": 26,
      "source_bytes": 406771312,
      "first_path": "00_READ_FIRST.md",
      "last_path": "99_VALIDATION_RECEIPT.json",
      "zip_bytes": 363559181,
      "zip_sha256": "4A21D9D017961B310AA809822B9A48F7940B4B7F6809EEC9BFD9C2807B57E979"
    }
  ],
  "members": [
    {
      "path": "00_READ_FIRST.md",
      "bytes": 2704,
      "sha256": "CA634414E398250C15ADEB54C452D5326D9F293356CAEC69D7C846E39E8D4B5D"
    },
    {
      "path": "02_ALL_45_LITERAL_SESSION_PROMPTS.md",
      "bytes": 258394,
      "sha256": "28A7B0CD03D9BAA61A28091F3280F24C0470483FFFFB9EAE88EED6AA3FD13A13"
    },
    {
      "path": "03_PHASE_AND_RANGE_MAP.tsv",
      "bytes": 6050,
      "sha256": "DEC43F92AD51869C05E797831B5DC7B0521487C51B25B2944C13AD30870CB604"
    },
    {
      "path": "04_PHYSICAL_FRAME_DISPOSITION_TEMPLATE.tsv",
      "bytes": 30714,
      "sha256": "6C5B16949975E0FB020E0D84FD694C28A1A67AE6548025CCCEA5EDE2CAC8839F"
    },
    {
      "path": "05_SOURCE_HIERARCHY_AND_EXACT_BOUNDARY.md",
      "bytes": 1904,
      "sha256": "7946E5D20565A3120A8C4B681A580B3D130936C9E89C99DEED2A024F8187AD31"
    },
    {
      "path": "06_ISSUE_AND_CORRECTION_LEDGER_TEMPLATE.tsv",
      "bytes": 130,
      "sha256": "CBD686F8E8E19CF8A6B4A0183F0D55F804204E817FDEFCE08939D031AA1DBAB3"
    },
    {
      "path": "07_FIGURE_AND_IMAGE_PROVENANCE_LEDGER_TEMPLATE.tsv",
      "bytes": 182,
      "sha256": "2CC79C66434D62124515310D318E85FD7DAA07EA53755CA4F51EE7A3BE5EA7C1"
    },
    {
      "path": "08_RETURN_TO_CODEX_CHECKPOINT_TEMPLATE.md",
      "bytes": 584,
      "sha256": "77C6C69A14CC08DECECE3268E0C992ABC225B558F5FAB0C0379421F6DA211593"
    },
    {
      "path": "09_ACCEPTED_OUTPUT_CONTRACT.md",
      "bytes": 887,
      "sha256": "BEBF7BC9522F99020EC6103A3C5730E99C9EE7545DA56820937BDFFB3611992C"
    },
    {
      "path": "20_AL_KHWARIZMI_AL_JABR_1939_AUTHORITY_FRAMES_001-035_400PPI.zip",
      "bytes": 47140632,
      "sha256": "9297AA946D4E676066A78A6A5CAE684B1E95B4EC4EE44FF60BF00EF31D62BC4D"
    },
    {
      "path": "21_AL_KHWARIZMI_AL_JABR_1939_AUTHORITY_FRAMES_036-070_400PPI.zip",
      "bytes": 46738712,
      "sha256": "CE3529CB28D79049D467D6AB454FB38FE6E21FAA32512B99A47489D535E65955"
    },
    {
      "path": "22_AL_KHWARIZMI_AL_JABR_1939_AUTHORITY_FRAMES_071-105_400PPI.zip",
      "bytes": 47741730,
      "sha256": "CCDC460235D6EB7B02402A83E968ADF8FBF40DE4025E36F3654296F004D85434"
    },
    {
      "path": "23_AL_KHWARIZMI_AL_JABR_1939_AUTHORITY_FRAMES_106-130_400PPI.zip",
      "bytes": 37393790,
      "sha256": "A55CD52647EDF4540A6D6FADD00AE47D06878F8E78F15F91395D7EAF947FB78B"
    },
    {
      "path": "24_AL_KHWARIZMI_AL_JABR_1939_INSTITUTIONAL_IIIF_MANIFEST.json",
      "bytes": 173593,
      "sha256": "43F767653C6E5EF867DBF0D7B7991B84AA1F33378EA3295B6E5812EF0A8F1B1E"
    },
    {
      "path": "25_AL_KHWARIZMI_AL_JABR_1939_IMAGE_INVENTORY_SHA256.csv",
      "bytes": 23773,
      "sha256": "8C33F3BC14078847AB22CB9D4679A4BD60AD90A7C2B82AF29D531CDC8B9206DA"
    },
    {
      "path": "26_AL_KHWARIZMI_AL_JABR_1939_IA_SCANDATA_COMPARATOR_ONLY.xml",
      "bytes": 39163,
      "sha256": "E0177646C0259F9FC362622BA07F0B72F3DE47C2871CA2DD91509A857CEC8973"
    },
    {
      "path": "27_AL_KHWARIZMI_AL_JABR_1939_NAVIGATION_AUTHORITY_130_FRAMES.pdf",
      "bytes": 224419407,
      "sha256": "25FA328D1AA460D54CC88280455A8E3067CB6660CB1523D293C717FEC3CAE843"
    },
    {
      "path": "28_NAVIGATION_PDF_AND_SOURCE_STREAM_VALIDATION.json",
      "bytes": 39484,
      "sha256": "1D459E2C46B7E618C8FFA735DD1ADECF67A81F09FCB228DF5EFD5EE12703FEE2"
    },
    {
      "path": "29_AL_KHWARIZMI_AL_JABR_1939_ALL_130_FRAMES_CONTACT_SHEET.jpg",
      "bytes": 1738976,
      "sha256": "C21D2C81435CFB91AB31AB3A679FBA5DF5D98BC7BF619ED7EEBA59B6FB446225"
    },
    {
      "path": "30_AL_KHWARIZMI_AL_JABR_1939_IMAGE_STREAM_VALIDATION.json",
      "bytes": 39060,
      "sha256": "26137A260D710F03A2F5EE6108B0818751B93D7C66E356FDCD0B47D1DC13E538"
    },
    {
      "path": "31_INHERITED_READERS_AND_TEX_UNTRUSTED.zip",
      "bytes": 963670,
      "sha256": "99EFD2353294BAFD15B45D20B63C5D379892106EB46771419C802FD0CBA14B0D"
    },
    {
      "path": "32_INHERITED_SALVAGE_MEMBER_INVENTORY.tsv",
      "bytes": 1485,
      "sha256": "148CE5B9E71FB14F2D6AC796149C79FF2FDEB11FCE69A5BE8B9CBAE7D038F4D7"
    },
    {
      "path": "33_INHERITED_OUTPUT_AUDIT_RECEIPT.json",
      "bytes": 4480,
      "sha256": "FEC97735EA3076C1935AC73FDFD39422333A406728F4341B26C4A721CC3D65D1"
    },
    {
      "path": "42_UNIVERSAL_SOURCE_FAITHFUL_PRODUCTION_STANDARD.txt",
      "bytes": 6576,
      "sha256": "504069B411632F330E6DFE43970E28B7FD6EE7DECC50288A846D920CAA7DC18B"
    },
    {
      "path": "98_PACKET_MANIFEST_SHA256.tsv",
      "bytes": 2920,
      "sha256": "077C6DA3F10C84A0140EBFC8CE3CC6D45101DB81BA7FD473C188A9B0C11FD1F5"
    },
    {
      "path": "99_VALIDATION_RECEIPT.json",
      "bytes": 2312,
      "sha256": "55DEAE318DF4FA9F6260C2EA61821A48E5C987EBD960769802AADA8A67C46770"
    }
  ],
  "checks": {
    "source_hash_replay": "26/26",
    "zip_member_replay": "26/26",
    "crc_errors": 0,
    "missing": 0,
    "extra": 0,
    "byte_mismatches": 0,
    "hash_mismatches": 0
  }
}
