{
  "schema": "math-commons-job-asset/v1",
  "job_id": "gauss-werke-v02-with-nachtrag",
  "wrapper_directory": "gauss-werke-v02-with-nachtrag",
  "source_files": 16,
  "source_bytes": 37450200,
  "canonical_stream_bytes": 1679,
  "source_tree_sha256": "B3FA260DAA25E9B11CBC6D057FF2C6150E53652E141610463455D9921EFF3F81",
  "asset_count": 1,
  "assets": [
    {
      "name": "gauss-werke-v02-with-nachtrag.zip",
      "part": 1,
      "parts": 1,
      "source_files": 16,
      "source_bytes": 37450200,
      "first_path": "00_READ_FIRST.md",
      "last_path": "99_VALIDATION_RECEIPT.json",
      "zip_bytes": 34493928,
      "zip_sha256": "2A9B161CA1059B56F6FF2A4CC26D087ADE06EDE3EFE1A47316BE79CCEF282E1D"
    }
  ],
  "members": [
    {
      "path": "00_READ_FIRST.md",
      "bytes": 4448,
      "sha256": "FDD9A7D32034D4FF2B1B3CB139D0A2D1EFBDA0A75BD66E9C8F8B6EEFFD2F8EE2"
    },
    {
      "path": "01_GOVERNING_INSTRUCTIONS.md",
      "bytes": 6409,
      "sha256": "8297EDA18A5B203896878E54C29E314EDEB2700D1263DB0701F1C18B3FEDBDEB"
    },
    {
      "path": "02_SOURCE_OUTPUT_MAP.tsv",
      "bytes": 4746,
      "sha256": "03458082FDEA4CD6DA18AFE0DD0D013A5297B01FD2DBFF4599908BC3C5FD4C7A"
    },
    {
      "path": "03_INITIAL_STATE.json",
      "bytes": 2444,
      "sha256": "B42375C0C1F2C4736CD82914E1E0E752B55F38399FFEDECF96CD8A7EF6CF0659"
    },
    {
      "path": "04_SESSION_PROMPTS.md",
      "bytes": 163056,
      "sha256": "DFE7C28E09E47F7F9A40A4D12E1AC19B1C5F9B6BC1A95EB7958079584FC89DDB"
    },
    {
      "path": "05_GDZ_MAIN_BAND_II_COMPLETE_PDF001-509.pdf",
      "bytes": 30856219,
      "sha256": "D2D682F21FE97AB46371D466EDF518998D8337AB66375F5F35B3F6853FFA125D"
    },
    {
      "path": "06_GDZ_NACHTRAG_COMPLETE_PDF001-038.pdf",
      "bytes": 1745631,
      "sha256": "A6AD4C27C0719190C3ECE4C8F61967EE463E8B32B26077D7507F76A4CED1F5FC"
    },
    {
      "path": "07_GDZ_MAIN_IIIF_MANIFEST.json",
      "bytes": 703557,
      "sha256": "ADF376CA53D7ABEB9A3248F9C01FDAC36FA2D0BB83CD838B853978B45CC54948"
    },
    {
      "path": "08_GDZ_NACHTRAG_IIIF_MANIFEST.json",
      "bytes": 50931,
      "sha256": "0379518A9418B0A34F512B17C388AEF67B858B4BCD7056F74D67EE3683B0E15D"
    },
    {
      "path": "09_BASELINE_PRINTED001-312_SOURCE.tex.txt",
      "bytes": 566333,
      "sha256": "5D9314E4C6704083655EB8360A39471CBB45423215E716D5F6D3921AD86CD007"
    },
    {
      "path": "10_BASELINE_PRINTED001-312_ENGLISH.tex.txt",
      "bytes": 560588,
      "sha256": "F431865B35D07FA7BFF0A5B358EC08D1ADAC94A6452A36C3E83C6488DFA98807"
    },
    {
      "path": "11_BASELINE_PRINTED001-312_SOURCE_RENDER.pdf",
      "bytes": 1402318,
      "sha256": "85059ECB3282F4E6D13EAAA31621A1AE42C9D8822DCD9474C5E1B8541E247AE4"
    },
    {
      "path": "12_BASELINE_PRINTED001-312_ENGLISH_RENDER.pdf",
      "bytes": 1376291,
      "sha256": "713697D980A3B485B10749BB1997369B14A983E9C0514A4D98839CDB010D480D"
    },
    {
      "path": "13_BASELINE_R38_STATUS_AND_INDICES.zip",
      "bytes": 3456,
      "sha256": "3BFF38897050E0A51837244FB7CC60F96873D8480E554F9E55166B0EA0C9392A"
    },
    {
      "path": "98_PACKET_MANIFEST_SHA256.tsv",
      "bytes": 1504,
      "sha256": "F3DC1E86A38B481482F0F4C7C9197F5615F7A6E575CB67F98BBD0F648522B1CB"
    },
    {
      "path": "99_VALIDATION_RECEIPT.json",
      "bytes": 2269,
      "sha256": "37444FC4CE1E7B0532D25A062A553F4BFD4C4305F1E52B96755149AADF23368D"
    }
  ],
  "checks": {
    "source_hash_replay": "16/16",
    "zip_member_replay": "16/16",
    "crc_errors": 0,
    "missing": 0,
    "extra": 0,
    "byte_mismatches": 0,
    "hash_mismatches": 0
  }
}
