{
  "schema": "math-commons-job-asset/v1",
  "job_id": "bhaskara-bijaganita-apte-1930",
  "wrapper_directory": "bhaskara-bijaganita-apte-1930",
  "source_files": 16,
  "source_bytes": 6600530,
  "canonical_stream_bytes": 1721,
  "source_tree_sha256": "B28DE077854B42AB594EFC61892E371970B3903DA297A512C1A0C12BD8CF4086",
  "asset_count": 1,
  "assets": [
    {
      "name": "bhaskara-bijaganita-apte-1930.zip",
      "part": 1,
      "parts": 1,
      "source_files": 16,
      "source_bytes": 6600530,
      "first_path": "00_READ_FIRST.md",
      "last_path": "99_VALIDATION_RECEIPT.json",
      "zip_bytes": 5688884,
      "zip_sha256": "B8D6989F39B2899EAF653FBE97133EB367DF7F6959C3870D44CC7563912B4A4C"
    }
  ],
  "members": [
    {
      "path": "00_READ_FIRST.md",
      "bytes": 3528,
      "sha256": "3E637E2ADBB6C9C4642E5CEAD94AA4F3FC635D4E892CB79339F0BCC12076B2D1"
    },
    {
      "path": "01_SOURCE_HIERARCHY_AND_BOUNDARY.md",
      "bytes": 896,
      "sha256": "DB0536BFD8B43018F642332076CB46AB929C2D5A36BD6F023D3D5CD05D5D73E9"
    },
    {
      "path": "03_PHYSICAL_AND_STRATUM_DISPOSITION_TEMPLATE.tsv",
      "bytes": 12456,
      "sha256": "A79C3153064BE62A97A5CC4D18D6B54EDE0BEBB6241203B944E9C096C58731CA"
    },
    {
      "path": "04_ALL_22_LITERAL_SESSION_PROMPTS.md",
      "bytes": 105714,
      "sha256": "C8076399AF46EE08F23DFD6B44E3AC3F310B086DAAA79CD59FC5E33EA4F34432"
    },
    {
      "path": "05_INHERITED_SALVAGE_MEMBER_INVENTORY.tsv",
      "bytes": 2408,
      "sha256": "5231A5F655F54E4A92DF603DC58ECE91225B2ACBBE9BA53733F5125C2DF65010"
    },
    {
      "path": "06_ISSUE_LEDGER_TEMPLATE.tsv",
      "bytes": 102,
      "sha256": "92AF2253EE4FC72A2127543024DEAE1DF1CA3D7D7ABE81B99E7303A785907DE8"
    },
    {
      "path": "07_RETURN_TO_CODEX_CHECKPOINT_TEMPLATE.md",
      "bytes": 2212,
      "sha256": "0B0C45065023CB2EBA2E476AD6DA9F11BBF3B0448DC417406EB6D7B652E871C5"
    },
    {
      "path": "20_BIJAGANITA_APTE_1930_COMPLETE_218P.pdf",
      "bytes": 4509171,
      "sha256": "0F69610F16CC4B2EB12E512070C1318FFD596CF003C5F6C897C891BBB007D610"
    },
    {
      "path": "21_BHASKARA_II_BIBLIOGRAPHY_REFERENCE.pdf",
      "bytes": 674310,
      "sha256": "B09BD977BC09D9D3F6A32E28FE3B942987869DFD048D15F324CD7E31DEE975AB"
    },
    {
      "path": "22_VPM_SOURCE_INDEX_EVIDENCE.html",
      "bytes": 26849,
      "sha256": "D84890365612471E51DEC9F56CC5F1D62BBC9D807509DDA8C8429BA832D382FE"
    },
    {
      "path": "30_PRIOR_BIJAGANITA_OUTPUTS_UNTRUSTED.zip",
      "bytes": 1241879,
      "sha256": "542DE6ED6BE55D3704DDB9AACAB0DE9C2C410D8118F65BB3913653F703DD8BBB"
    },
    {
      "path": "41_WORK_SIZED_GOVERNING_INSTRUCTIONS.md",
      "bytes": 3334,
      "sha256": "584CBFCA692428CF928A6930634C31A7C6F94B338AED2C496434674B651EEAD4"
    },
    {
      "path": "42_UNIVERSAL_SOURCE_FAITHFUL_PRODUCTION_STANDARD.txt",
      "bytes": 6575,
      "sha256": "9DC482BBF99DA7A04E6769A2ED67EA53CA0FC4E74C65F77A1B848B143F43C626"
    },
    {
      "path": "43_INITIAL_WORKFLOW_STATE.md",
      "bytes": 3096,
      "sha256": "412455347F48ED10FA826CF9B2ECA2303C8691B5596844E7FCBC02BF591E2933"
    },
    {
      "path": "98_PACKET_MANIFEST_SHA256.tsv",
      "bytes": 1546,
      "sha256": "886352A6D18D892E96248BEFB0BB8696E3CFD6A8584B4C3EB4CCD434663ABCFE"
    },
    {
      "path": "99_VALIDATION_RECEIPT.json",
      "bytes": 6454,
      "sha256": "AA159660E43B4BA4EE65C7045BC52E20556E73D7D28083A139A0E4CF18258316"
    }
  ],
  "checks": {
    "source_hash_replay": "16/16",
    "zip_member_replay": "16/16",
    "crc_errors": 0,
    "missing": 0,
    "extra": 0,
    "byte_mismatches": 0,
    "hash_mismatches": 0
  }
}
