{
  "schema": "math-commons-job-asset/v1",
  "job_id": "khayyam-columbia-ms-or34-algebra",
  "wrapper_directory": "khayyam-columbia-ms-or34-algebra",
  "source_files": 10,
  "source_bytes": 331443345,
  "canonical_stream_bytes": 1007,
  "source_tree_sha256": "5BF6C314386E229BA378DEBE6B53BA901D64F2E530CB5942000261C2A35F0A2B",
  "asset_count": 1,
  "assets": [
    {
      "name": "khayyam-columbia-ms-or34-algebra.zip",
      "part": 1,
      "parts": 1,
      "source_files": 10,
      "source_bytes": 331443345,
      "first_path": "00_READ_FIRST.txt",
      "last_path": "10_COLUMBIA_MS_OR34_SOURCE_AND_PRIOR_STATE_EXACT.zip",
      "zip_bytes": 331472031,
      "zip_sha256": "8616DF219CDD6566DD298BA56BAFBF7B87DD0419581670DAA6E98F9A2D85C666"
    }
  ],
  "members": [
    {
      "path": "00_READ_FIRST.txt",
      "bytes": 3555,
      "sha256": "3D74F69D3F9285C85836759C9A2411DFE483AD8496D80A2305DC25146BE4CCA8"
    },
    {
      "path": "01_GOVERNING_INSTRUCTIONS.txt",
      "bytes": 3358,
      "sha256": "A19497785DF3D9C2E55F47F5B5F888D3464993E84F26D17F0F31A63C3EB02565"
    },
    {
      "path": "02_ALL_13_LITERAL_SESSION_PROMPTS.txt",
      "bytes": 60524,
      "sha256": "D4AF7C3272E5958685A21A8DF86F5C5FA95ECF784E60E0D145774AB16F00BCF9"
    },
    {
      "path": "03_SOURCE_OUTPUT_MAP.tsv",
      "bytes": 4849,
      "sha256": "2FB89B59D69AEDE4632EFC070AC4D705D24E25EF4385C4B13EF57824EF676801"
    },
    {
      "path": "04_SOURCE_JOB_MAP.tsv",
      "bytes": 2525,
      "sha256": "0904F27C0474FB90B66C5A0B8E189EB093F20B93F1B1833C319E0E8B49E8899F"
    },
    {
      "path": "05_INITIAL_STATE.md",
      "bytes": 2330,
      "sha256": "CDBDD77FE1BF38E874F250E5F31FA2769DA5F5626D75C9C62EDE47A2933EA86E"
    },
    {
      "path": "06_RETURN_CONTRACT_AND_COLD_AUDIT.txt",
      "bytes": 2984,
      "sha256": "F5F586EDF8D8ED16C7A05A921B7F4CBFF445F3C96C5120ACBBD54EA40B0B2CB5"
    },
    {
      "path": "07_PACKET_MANIFEST.tsv",
      "bytes": 3039,
      "sha256": "DD561FD2EE687E9E1AFD482A4452DC5A2BBD0A7F03DFA0B8E2AEC10BA76C8A77"
    },
    {
      "path": "08_PACKET_VALIDATION_RECEIPT.json",
      "bytes": 4725,
      "sha256": "28E8159A8B76D3780D8A1C367A9B644DA3DC5BC39082993B4A855D7FD5DA131F"
    },
    {
      "path": "10_COLUMBIA_MS_OR34_SOURCE_AND_PRIOR_STATE_EXACT.zip",
      "bytes": 331355456,
      "sha256": "B3A39EAF4BE64782561094F1ED2A25744F2F850CEF7C45EB169779DEC18389FB"
    }
  ],
  "checks": {
    "source_hash_replay": "10/10",
    "zip_member_replay": "10/10",
    "crc_errors": 0,
    "missing": 0,
    "extra": 0,
    "byte_mismatches": 0,
    "hash_mismatches": 0
  }
}
