{
  "schema": "math-commons-job-asset/v1",
  "job_id": "gibbs-scientific-papers-v01",
  "wrapper_directory": "gibbs-scientific-papers-v01",
  "source_files": 12,
  "source_bytes": 103674579,
  "canonical_stream_bytes": 1222,
  "source_tree_sha256": "97E74475E5715B6FADFE1402025BF4DA05A511116B2F55AF4C90B7D98C2DE4E1",
  "asset_count": 1,
  "assets": [
    {
      "name": "gibbs-scientific-papers-v01.zip",
      "part": 1,
      "parts": 1,
      "source_files": 12,
      "source_bytes": 103674579,
      "first_path": "00_READ_FIRST.md",
      "last_path": "99_MANIFEST_SHA256.json",
      "zip_bytes": 101592856,
      "zip_sha256": "7FCACC4181AD7DF04DCF03FE70AD2D8445E72E66A236F03A0307B13C1E38C641"
    }
  ],
  "members": [
    {
      "path": "00_READ_FIRST.md",
      "bytes": 3015,
      "sha256": "6EFDF134D3AD53EDC16BC6979007376C9109ACC42A6D563FAC06C050522F1D04"
    },
    {
      "path": "01_GOVERNING_INSTRUCTIONS.md",
      "bytes": 3367,
      "sha256": "502C619CA76CB2145B2F50F8A0616359E9F839B03D5E83D926B415AF558ED220"
    },
    {
      "path": "02_EXACT_SOURCE_OUTPUT_MAP.json",
      "bytes": 1636,
      "sha256": "4384E45FC37D8126FD82E8A036228790045083B62FCE8464E338C0E3AB87E890"
    },
    {
      "path": "03_INITIAL_STATE.json",
      "bytes": 1004,
      "sha256": "56414724DD04ECDB8BD03A2E1E3B6548D94C3504910EAAE9FA13F710598E8BE0"
    },
    {
      "path": "04_ALL_44_LITERAL_SESSION_PROMPTS.md",
      "bytes": 226129,
      "sha256": "F970DE8986C1AC3031D6ABC8183B81203F0DD8227DB4E2B1D86A9DED83F4E78B"
    },
    {
      "path": "05_WORK_SIZED_PROMPT_MAP.tsv",
      "bytes": 3090,
      "sha256": "D4F3C229D2F2828BA2F13C15B26C5BA91D0B4DFD8CCDEB793478DD491CCC4BB6"
    },
    {
      "path": "11_EXISTING_PUBLIC_WORKING_PP001-134_EXACT.zip",
      "bytes": 30417741,
      "sha256": "333A971F16DEFF240419D22CB2BB82F464B1C8351ECB507D9280B874E3E22F96"
    },
    {
      "path": "12_EXISTING_PRINT135-143_PACKET_BYTE_EXACT.zip",
      "bytes": 11618337,
      "sha256": "1F0E15040E21C9E071B84EFCB44D5E9CF3153617CCF57645D5EF1872A429A66D"
    },
    {
      "path": "22_SP1_NAVIGATION.pdf",
      "bytes": 48996892,
      "sha256": "7F6312FF2DAB6E618C99D136875BFA8ED67E52A278E6ECA1C296378D90E51FBF"
    },
    {
      "path": "40_EQ_COMPARATOR_NAVIGATION.pdf",
      "bytes": 12399268,
      "sha256": "3323AF89D5381E4F9BE3D83E7637C8FD72A69D54E37AC83E165292E686BED77E"
    },
    {
      "path": "98_PACKET_VALIDATION.json",
      "bytes": 1959,
      "sha256": "937007F4990122A7F98F9763776047F49743D359CEA56B3571A60B3513F7EB56"
    },
    {
      "path": "99_MANIFEST_SHA256.json",
      "bytes": 2141,
      "sha256": "E31D4E51C7A2702B47CABAE340BFC7D50BEC916EDB27FC3BCD592CFB05FF934C"
    }
  ],
  "checks": {
    "source_hash_replay": "12/12",
    "zip_member_replay": "12/12",
    "crc_errors": 0,
    "missing": 0,
    "extra": 0,
    "byte_mismatches": 0,
    "hash_mismatches": 0
  }
}
