{
  "schema": "math-commons-job-asset/v1",
  "job_id": "cayley-collected-papers-v01",
  "wrapper_directory": "cayley-collected-papers-v01",
  "source_files": 11,
  "source_bytes": 176004219,
  "canonical_stream_bytes": 1165,
  "source_tree_sha256": "1A07697AE3DC613CCACD9D9FD3967EDE005C1A637EC34EF99A85E56FB07E857E",
  "asset_count": 1,
  "assets": [
    {
      "name": "cayley-collected-papers-v01.zip",
      "part": 1,
      "parts": 1,
      "source_files": 11,
      "source_bytes": 176004219,
      "first_path": "00_READ_FIRST.md",
      "last_path": "cayley_source_master_vol01_collectedmathema01cayluoft_jp2.zip",
      "zip_bytes": 171921441,
      "zip_sha256": "AC33E330ECAC16E7C283CD33B15BD849AE3B7ED329753F5AF7FFC3247A318F36"
    }
  ],
  "members": [
    {
      "path": "00_READ_FIRST.md",
      "bytes": 5219,
      "sha256": "955C623F1F181D3B9214CD310AFDDFE7C2530D5A2AACF0C1931EB435017AFC47"
    },
    {
      "path": "01_GOVERNING_INSTRUCTIONS.md",
      "bytes": 4257,
      "sha256": "AA8BB1EDA988D2B5FA1884E05064C5D0C2239EA11C779665779F5D09FCC60483"
    },
    {
      "path": "02_VOLUME_SOURCE_MAP.tsv",
      "bytes": 715,
      "sha256": "DCFBC89556AA61DFD3551C3C52BE9BDA711175AA5E0E52A81352447085011115"
    },
    {
      "path": "03_INITIAL_STATE.json",
      "bytes": 1987,
      "sha256": "5FF84BADB1791A3CAA070A81DC0904A86AA9C9069B7EC8A8A2594197BB7A0CFB"
    },
    {
      "path": "04_ALL_45_LITERAL_SESSION_PROMPTS.md",
      "bytes": 173331,
      "sha256": "D345E95110791779BEDCDC995F577FF7159B26B855BAAB6037209D6B7B32DF69"
    },
    {
      "path": "30_PRIOR_VOLUME_I_LINEAGES_UNTRUSTED.zip",
      "bytes": 3698728,
      "sha256": "28C159ADA0D13B92383240944FBA452D9607F9A6A4DD6241E80D267EEE8E3BA6"
    },
    {
      "path": "98_PACKET_MANIFEST_SHA256.tsv",
      "bytes": 996,
      "sha256": "F34642E1643A17E43095DDF351AF102807D59B53C3E5B1E9B930940A59750B14"
    },
    {
      "path": "99_VALIDATION_RECEIPT.json",
      "bytes": 2286,
      "sha256": "3A8C963672711153B87FC0B821F2BC47FC943FE64D5907B858EDB7C58693CF91"
    },
    {
      "path": "CODEX_STRICT_AUDIT_cayley_vol_i_clean_20260605.md",
      "bytes": 6127,
      "sha256": "49ED60DAE20249FF8CA3F5589A511EDC3BABF5CA8C29CF6E64D1CD23BD9557F7"
    },
    {
      "path": "Cayley_unitized_index_v01_CODEX_20260607.zip",
      "bytes": 303542,
      "sha256": "680121F68B11D451B6452BECF8708D5938C06E79F79DE5F4D5D3BB6B7C5CE7FE"
    },
    {
      "path": "cayley_source_master_vol01_collectedmathema01cayluoft_jp2.zip",
      "bytes": 171807031,
      "sha256": "23A0A59D90BDC94FE5AB2B97655F2A6C1581C8BE5F8E513D4F59DCDB95ED49C1"
    }
  ],
  "checks": {
    "source_hash_replay": "11/11",
    "zip_member_replay": "11/11",
    "crc_errors": 0,
    "missing": 0,
    "extra": 0,
    "byte_mismatches": 0,
    "hash_mismatches": 0
  }
}
