{
  "schema": "math-commons-job-asset/v1",
  "job_id": "bhaskara-lilavati-1907",
  "wrapper_directory": "bhaskara-lilavati-1907",
  "source_files": 21,
  "source_bytes": 512388402,
  "canonical_stream_bytes": 2329,
  "source_tree_sha256": "D1BB47DCD3BDB75617BFF0B808A87F8E3983FA631C300DFD13A59AC079F6D3C0",
  "asset_count": 1,
  "assets": [
    {
      "name": "bhaskara-lilavati-1907.zip",
      "part": 1,
      "parts": 1,
      "source_files": 21,
      "source_bytes": 512388402,
      "first_path": "00_READ_FIRST.md",
      "last_path": "99_VALIDATION_RECEIPT.json",
      "zip_bytes": 509068073,
      "zip_sha256": "55BAC857810A2CAA8B7F02F3E24E10867E16F43A725287C2D5471CDC8C73956B"
    }
  ],
  "members": [
    {
      "path": "00_READ_FIRST.md",
      "bytes": 1990,
      "sha256": "6D856FEC017793B0CDF05FD5C7BAD119FF439C9814C9EED6C5AD7530BA91AF1A"
    },
    {
      "path": "01_SOURCE_HIERARCHY_AND_BOUNDARY.md",
      "bytes": 1001,
      "sha256": "288FA0DB8928DAB03949B2C06FF71869163BB23FAD0DF23AE79C11685F76F7A4"
    },
    {
      "path": "03_PHYSICAL_AND_STRATUM_DISPOSITION_TEMPLATE.tsv",
      "bytes": 13744,
      "sha256": "D79F554597FF316B3027C590E3E37612E35D40DD220A86EC6E4CD199802C42F6"
    },
    {
      "path": "04_ALL_45_LITERAL_SESSION_PROMPTS.md",
      "bytes": 245995,
      "sha256": "F2389D1444632E81B2CB1880AABBABC872ADA549630385F17AC17E2943677805"
    },
    {
      "path": "05_INHERITED_SALVAGE_MEMBER_INVENTORY.tsv",
      "bytes": 1503,
      "sha256": "370A1AEE8E27A5D3293549217025B462ADDE8D53D66DAF7DC5E34EC759903FA5"
    },
    {
      "path": "06_ISSUE_LEDGER_TEMPLATE.tsv",
      "bytes": 103,
      "sha256": "6834A7B8340596DC1A7F4719DE16ACE3ECFD231FFDCFFA8B5EF3BFBBBC06C435"
    },
    {
      "path": "07_RETURN_TO_CODEX_CHECKPOINT_TEMPLATE.md",
      "bytes": 415,
      "sha256": "B570C6452085996DBE2DB9E8BC27DB55D65B919834AC3E9CE25C3B94CE4D8087"
    },
    {
      "path": "20_LILAVATI_1907_NATIVE_JP2_MASTER_280_FRAMES.zip",
      "bytes": 156342081,
      "sha256": "96ADC2BFFF925CFFE213E90CC7447E611268803CD1F66EC9E31F3195C6D50576"
    },
    {
      "path": "21_LILAVATI_1907_NAVIGATION_280_FRAMES.pdf",
      "bytes": 171365094,
      "sha256": "D05EEF423CBF6D4FE1FA512006B652D8F6C625539D19CF257ED151DF89807151"
    },
    {
      "path": "22_LILAVATI_1907_SCANDATA_280_FRAMES.xml",
      "bytes": 100422,
      "sha256": "920E3A2162F429A119557206A516B4D6AC353E10C50C3EF8C9696D5CEB489A64"
    },
    {
      "path": "23_LILAVATI_1907_IA_METADATA.json",
      "bytes": 1766,
      "sha256": "4DB2141E8D621F67B37C3BC41B27448E05B3E259FC50E226E9626F90C39D0C7E"
    },
    {
      "path": "24_LILAVATI_SECONDARY_COMPARATOR_268_FRAMES.pdf",
      "bytes": 158368958,
      "sha256": "13DBDC030DC9E88D6458F44363550B6932DFE4042DFAFCFE1CAA4A84BF336066"
    },
    {
      "path": "25_LILAVATI_APTE_1937_PART1_COMPARATOR.pdf",
      "bytes": 10724905,
      "sha256": "51F354072D5247BADBBF563E7ED8A446F55192D8DEC04A025A49DD9135CC3FBE"
    },
    {
      "path": "26_LILAVATI_APTE_1937_PART2_COMPARATOR.pdf",
      "bytes": 13999404,
      "sha256": "2C2D562AFE872EC44EDCE5BD7E78489DCD472ED5ED6E2D00C839A326133997C2"
    },
    {
      "path": "27_BHASKARA_II_BIBLIOGRAPHY_REFERENCE.pdf",
      "bytes": 674310,
      "sha256": "B09BD977BC09D9D3F6A32E28FE3B942987869DFD048D15F324CD7E31DEE975AB"
    },
    {
      "path": "28_VPM_SOURCE_INDEX_EVIDENCE.html",
      "bytes": 26849,
      "sha256": "D84890365612471E51DEC9F56CC5F1D62BBC9D807509DDA8C8429BA832D382FE"
    },
    {
      "path": "30_PRIOR_LILAVATI_OUTPUTS_UNTRUSTED.zip",
      "bytes": 502226,
      "sha256": "812608389F8E1362E83221E0341DBA0FBCEDFB7EE56C46A4279FD34A42AE47C8"
    },
    {
      "path": "31_PRIOR_LILAVATI_PACKET_CONTROLS_UNTRUSTED.zip",
      "bytes": 6594,
      "sha256": "ECCEDB529783AE8C98296E0B002D66528838D1B2FC6428717DFF088498D697A8"
    },
    {
      "path": "42_UNIVERSAL_SOURCE_FAITHFUL_PRODUCTION_STANDARD.txt",
      "bytes": 6576,
      "sha256": "504069B411632F330E6DFE43970E28B7FD6EE7DECC50288A846D920CAA7DC18B"
    },
    {
      "path": "98_PACKET_MANIFEST_SHA256.tsv",
      "bytes": 2154,
      "sha256": "1AD448FE66EFE008DFC979AFBC8A3F88D991259D1B3E8F6DB7F4684C1BED8386"
    },
    {
      "path": "99_VALIDATION_RECEIPT.json",
      "bytes": 2312,
      "sha256": "D02E09A44FE904BDB9BE81FB7560CC3D04DF5A09A1115B2BFCA9A6BFD8DA4AC1"
    }
  ],
  "checks": {
    "source_hash_replay": "21/21",
    "zip_member_replay": "21/21",
    "crc_errors": 0,
    "missing": 0,
    "extra": 0,
    "byte_mismatches": 0,
    "hash_mismatches": 0
  }
}
